{
  "created_at_utc": "2026-09-02T17:17:55.640591+00:00",
  "evidence": [
    "results/frozen/v2-final/freeze.json",
    "results/frozen/v2-final/one-shot.json",
    "results/final/test100-aggregate.json",
    "results/validation/dev100-decision.json",
    "configs/v2.yaml"
  ],
  "experiment_id": "v2-final-test100",
  "files": [
    {
      "bytes": 1428,
      "class": "input",
      "path": "configs/v2.yaml",
      "sha256": "6a0f8b10adf0ea79f3788e6b624d8090516f9f1039037fa04700fe5ed0d190ed"
    },
    {
      "bytes": 49361,
      "class": "registry",
      "path": "results/analysis/train150-context-grid-final/max-r1-cap30.json",
      "sha256": "ae4bbbc68edc8a7678d741e7bf364868598f140814b1f3ed422ea24715329bd6"
    },
    {
      "bytes": 49393,
      "class": "registry",
      "path": "results/analysis/train150-context-grid-final/max-whole-cap20.json",
      "sha256": "a1acddb61b7afb464f18616b992ecfcec14a1013eb7388fea6c8deee782585d0"
    },
    {
      "bytes": 49356,
      "class": "registry",
      "path": "results/analysis/train150-context-grid-final/mean-r1-cap20.json",
      "sha256": "1577cdbdf59a052e02b040eaeaea583699b97999024a79660263b5c84ed78b5e"
    },
    {
      "bytes": 49348,
      "class": "registry",
      "path": "results/analysis/train150-context-grid-final/mean-r1-cap30.json",
      "sha256": "f07f1ee267696c9624c4d7ccf9fdafd069b3f880b683e96838e512f400b4bb7a"
    },
    {
      "bytes": 49346,
      "class": "registry",
      "path": "results/analysis/train150-context-grid-final/mean-r1-cap40.json",
      "sha256": "6ff4f8ef4b07bd3a5768d417b9084b5c85b77619b324c01ac6bae2b9d3831bd3"
    },
    {
      "bytes": 49323,
      "class": "registry",
      "path": "results/analysis/train150-context-grid-final/mean-r2-cap30.json",
      "sha256": "bee19966ca0f02e6e741a5a44dc1c51ffd3bd842bde0ec5f2cd3518ff3ac2458"
    },
    {
      "bytes": 49380,
      "class": "registry",
      "path": "results/analysis/train150-context-grid-final/mean-whole-cap20.json",
      "sha256": "99dd9accf291274954ce6fcdbd35a91ec168e2d3f0327106e616e63c97fde6ae"
    },
    {
      "bytes": 5795,
      "class": "registry",
      "path": "results/analysis/train150-context-selection.final.json",
      "sha256": "1294c8448ae21ad2f1b557aef14eb693508c39f7db196f5d67840e6be8ef4476"
    },
    {
      "bytes": 710,
      "class": "registry",
      "path": "results/analysis/train150-ingest-state.final.json",
      "sha256": "41cdc687c48e4a01e60cf32afe50d78326073b18a91d3fddf2197fcbcba7fd39"
    },
    {
      "bytes": 49348,
      "class": "registry",
      "path": "results/analysis/train150-session-recall.final.json",
      "sha256": "f07f1ee267696c9624c4d7ccf9fdafd069b3f880b683e96838e512f400b4bb7a"
    },
    {
      "bytes": 1008632,
      "class": "registry",
      "path": "results/analysis/train150-zero-yield.final.json",
      "sha256": "d52d94c889ad0a91d5b1d74c81248065d219020ea1d4d3b862fd89d86295f4bc"
    },
    {
      "bytes": 2405,
      "class": "registry",
      "path": "results/analysis/train150-zero-yield.final.md",
      "sha256": "f5f29c8f0407e7417ebdec1dca9fe065b2a5694fb5de7cd858c0185df68d06c9"
    },
    {
      "bytes": 1133,
      "class": "audit",
      "path": "results/archive/v2-final/README.md",
      "sha256": "3241c8f1d20780146a6bea6b3642b1d98b14d837df6eebbce05251a4be746627"
    },
    {
      "bytes": 426704,
      "class": "audit",
      "path": "results/archive/v2-final/source.tar.gz",
      "sha256": "203c708e0f3de6019944371735a442367132eb219b8121e026b0c0488ba91714"
    },
    {
      "bytes": 5703,
      "class": "summary",
      "path": "results/final/test100-aggregate.json",
      "sha256": "f0b5d491296662ff0e336a33e137d46afc954ce5d2d45e2d7454d98105cb5bf2"
    },
    {
      "bytes": 2721,
      "class": "summary",
      "path": "results/final/test100-aggregate.md",
      "sha256": "822b16c6d215e58eabe3a44babdde63cde337203ee7e061c1ca40bde6123ece3"
    },
    {
      "bytes": 26583,
      "class": "audit",
      "path": "results/frozen/v2-final-preingest/freeze.json",
      "sha256": "47d1a3a4d79fc761ef2edae992c2f212a25e103c1f2987e4e2f63da0af2c8259"
    },
    {
      "bytes": 28255,
      "class": "audit",
      "path": "results/frozen/v2-final/freeze.json",
      "sha256": "eb859d1643edbc4fd893c6210e96862e9bad972e81be11f55487e0a637213d13"
    },
    {
      "bytes": 726,
      "class": "outcome",
      "path": "results/frozen/v2-final/one-shot.json",
      "sha256": "6ddf400d6c653d097ca29265a5d35a96100d6b903cfdb0f09a7801d2b7a4aa63"
    },
    {
      "bytes": 12434,
      "class": "registry",
      "path": "results/prereg-context-shape.md",
      "sha256": "3f03414d948ff7eea871d1f230fbc8473fe11331ba84cb74d28cb26df8dd5edf"
    },
    {
      "bytes": 2850,
      "class": "registry",
      "path": "results/prereg-v2-final.md",
      "sha256": "32d57a814fb504bf6591dd783fb1e038a55a947785fc409b91ad412422fea7a9"
    },
    {
      "bytes": 298737,
      "class": "usage",
      "path": "results/raw/test100.ingest.usage.json",
      "sha256": "174f0b6e6a304bce2a33e4b2a08c38f9a280d88d02933fba4c755c86aa63fd99"
    },
    {
      "bytes": 89926,
      "class": "raw",
      "path": "results/sealed/test100/full_context.jsonl",
      "sha256": "38ae22e6bc979bd12c656d05588946d68a1ab055d6ed2f81a92097b51e01eecb"
    },
    {
      "bytes": 43653,
      "class": "usage",
      "path": "results/sealed/test100/full_context.usage.json",
      "sha256": "847acc6801fb4e598e792aa6b89292b169974933a98d60e1b053f45ad2641dcb"
    },
    {
      "bytes": 90954,
      "class": "raw",
      "path": "results/sealed/test100/naive_rag.jsonl",
      "sha256": "a8ad7bee1c185071199b172ecca256bf47c8d2b84dfb419d88e2537c881401b7"
    },
    {
      "bytes": 44666,
      "class": "usage",
      "path": "results/sealed/test100/naive_rag.usage.json",
      "sha256": "458ea9f88ebd0ac9292e59a72b238475ec8a1dc4e66ff398483033230c3587c6"
    },
    {
      "bytes": 629832,
      "class": "raw",
      "path": "results/sealed/test100/v2.jsonl",
      "sha256": "91b00f1d4d1d1d772eab95518b32d30b387e8d593f2fe4284d80d6cadfdd122b"
    },
    {
      "bytes": 49537,
      "class": "usage",
      "path": "results/sealed/test100/v2.usage.json",
      "sha256": "56f7392d066ff4e3f901ceb25dbc6169ddaf17e97eb3f9cdf86f28d190a455aa"
    },
    {
      "bytes": 14270,
      "class": "registry",
      "path": "results/validation/dev100-aggregate.json",
      "sha256": "155351b99ace6ce38170490f2247412e4feefdbf5c7d451cb9296899e7fcdcb2"
    },
    {
      "bytes": 649,
      "class": "registry",
      "path": "results/validation/dev100-decision.json",
      "sha256": "1c4bef3419e1a77ebc3e33fd398ad17bb600ac5dcf788e630b9ffc040384de40"
    },
    {
      "bytes": 14142,
      "class": "audit",
      "path": "tools/verify_v2_conclusion.py",
      "sha256": "b40ae362757dd3b2d703f8baee6a049b5f8621cb28ccc1670ae2bbd0670cf318"
    }
  ],
  "fingerprints": {
    "config_sha256": "6a0f8b10adf0ea79f3788e6b624d8090516f9f1039037fa04700fe5ed0d190ed",
    "inputs_sha256": "b0a8831a6b8221edbfeebf39a5d0e69a34b4a2c5c1e572b7c276234aaddf27e5",
    "source_sha256": "ad00da208bdee4d5f46be68ba6723ffe08689619966338023a68813d31dc23e8",
    "store_sha256": "129576789a91978d5b72960e04dbf08ca048066d0b40625aa98d2b5259abc1b1"
  },
  "outcome": "inconclusive",
  "outcome_reason": "v2 was stable at 72% and used far less context, but its +7 point result over naive RAG was not statistically conclusive and full context was significantly more accurate.",
  "producer": {
    "command": "tools/verify_v2_conclusion.py --capture",
    "source_commit": "969f907d659fd7b7c1b01cd893ef891a10f36dfe"
  },
  "schema_version": 1,
  "summary_file": "results/final/test100-aggregate.json"
}
